Theme Id,Theme Name,Definition,Keywords,Status,Objective Count,Original Statements
,,,,,,4141 | To improve the morale of school children and help them progress in their field | 0.7554
,,,,,,"3787 | To address the teacher shortage in our school by ensuring timely payment of salaries, thereby improving teacher retention and overall education quality. | 0.6598"
,,,,,,3797 | To address the lack of playgrounds in school due to financial constraints | 0.6494
,,,,,,15667 | To provide quality education to students despite the shortage of subject teachers | 0.6867
,,,,,,15563 | To emphasize the significance of education in solving problems | 0.6782
,,,,,,19914 | To ensure children attend school regularly and receive scholarships | 0.7394
,,,,,,3862 | To provide quality education to children in the evenings due to teacher shortage in school | 0.7639
,,,,,,28935 | To increase the number of children attending school | 0.8304
,,,,,,28462 | To improve children | 0.882
,,,,,,29274 | To improve children | 0.882
,,,,,,29281 | To empower children through education and develop their leadership qualities | 0.7507
,,,,,,29431 | To improve education by attending school regularly | 0.7243
,,,,,,35531 | To improve education for children | 0.9464
,,,,,,36075 | To increase children | 0.7953
,,,,,,40427 | To improve education by addressing health issues | 0.6705
6692b0bb-893e-4f36-97d2-821ee61738f6,Enhancing Government School Effectiveness through Stakeholder Engagement and Quality Improvement,"This theme encompasses multifaceted strategies aimed at elevating the quality of education and overall effectiveness of government schools. It focuses on fostering robust parental involvement and communication as a critical lever for improving student learning outcomes, academic performance, and confidence, while also addressing systemic challenges related to infrastructure, resources, and teaching quality.","parental involvement,quality of education,student learning outcomes,government schools,stakeholder engagement,parent-teacher collaboration,educational improvement",Draft,74,17 | To improve parental involvement in government schools | 0.8816
,,,,,,68 | To improve the quality of education in government schools | 0.7459
,,,,,,132 | To enhance student learning and increase parent involvement in education through activity-based teaching methods | 0.6737
,,,,,,160 | To improve parental involvement and communication to support student learning and academic performance | 0.764
,,,,,,133 | To increase parent participation and engagement in Parent-Teacher Meetings (PTMs) through proactive planning and sensitization | 0.6379
,,,,,,146 | To improve parental involvement in education and enhance student learning outcomes | 0.804
,,,,,,"115 | To enhance the quality of education in government schools by addressing infrastructure, teaching quality, and resource issues. | 0.6933"
,,,,,,151 | To improve student confidence by increasing parent-teacher collaboration and communication | 0.6464
,,,,,,120 | To address challenges in government schools and improve the quality of education | 0.7249
,,,,,,123 | To improve educational outcomes by addressing the challenges faced by government schools. | 0.7059
,,,,,,153 | To improve student performance by increasing parental involvement in their child's education | 0.8262
,,,,,,5017 | To change parents' perception of government schools | 0.7662
,,,,,,4192 | To increase enrollment in government schools by addressing parental misconceptions and improving school quality | 0.8087
,,,,,,28600 | To increase parental involvement in education by addressing the challenges faced by daily wage laborer parents | 0.7506
,,,,,,3374 | To make parental engagement a continuous habit in the school | 0.666
,,,,,,28662 | To increase parental involvement in their children's education | 0.8824
,,,,,,4188 | To improve the education quality in government schools and change the mindset of parents towards government schools | 0.7712
,,,,,,4191 | To change the mindset of parents that government schools are better than private schools | 0.7441
,,,,,,41553 | To improve the quality of education in government schools and increase enrollment | 0.7692
,,,,,,40687 | To improve concentration in children through activities and parental involvement | 0.5828
,,,,,,40698 | To increase parental participation in parent-teacher meetings and improve children's education | 0.8435
,,,,,,29297 | To encourage children to participate in extracurricular activities by educating parents and teachers about its importance | 0.675
,,,,,,40732 | To increase parental awareness and involvement in their children | 0.7907
,,,,,,40834 | To improve parent-teacher meetings in Hirapur Chak Middle School by increasing parent participation and engagement. | 0.6997
,,,,,,40853 | To increase parental involvement in children's education | 0.869
,,,,,,40866 | To increase parental awareness and involvement in their children | 0.7907
,,,,,,40867 | To educate parents about the importance of attending parent meetings and to increase their participation | 0.7324
,,,,,,"40899 | To establish regular parent-teacher meetings in Jamuhar Mohanpur, ensuring active participation and open communication between parents, teachers, and the community. | 0.615"
,,,,,,4189 | To change the mindset of parents towards government schools | 0.763
,,,,,,40962 | To improve the educational system in government schools by breaking the myth that there is no education in these schools and strengthening the system | 0.6883
,,,,,,41083 | To improve education by increasing parental involvement and understanding of its importance | 0.8579
,,,,,,4190 | To change the mindset of parents towards government schools by showcasing their potential and successes | 0.7287
,,,,,,41289 | To improve the quality of education in government schools by increasing awareness among parents and the community about the benefits of government schools over private schools. | 0.7807
,,,,,,15462 | To improve learning in children by conducting regular parents and teachers meetings | 0.7594
,,,,,,41490 | To improve parent-teacher communication and increase parental involvement in children | 0.7927
,,,,,,41548 | To improve parental involvement in education by increasing attendance at PTM meetings | 0.8032
,,,,,,49014 | To increase enrollment in government schools by addressing parents | 0.829
,,,,,,49017 | To increase enrollment in government schools by addressing parental concerns and promoting education outreach | 0.8246
,,,,,,49020 | To increase enrollment in government schools by addressing parental concerns about English language instruction | 0.7337
,,,,,,49021 | To increase parental involvement in education by informing them about the importance of attending PTM meetings and understanding their children's behavior and academic performance in school | 0.8208
,,,,,,16517 | To improve the quality of education in government schools and increase enrollment | 0.7692
,,,,,,4552 | To improve the quality of education in government schools and increase parental trust | 0.8393
,,,,,,"4554 | To improve the quality of education in government schools and increase enrollment by addressing the challenges of poverty, parental mindset, and teacher shortage. | 0.8172"
,,,,,,28712 | To increase parental involvement in their children | 0.7957
,,,,,,8532 | To increase parental involvement in children | 0.7975
,,,,,,11160 | To increase parent participation in school meetings by making them active contributors to the discussion | 0.6601
,,,,,,4186 | To improve the education system in government schools and increase parental involvement | 0.9013
,,,,,,16844 | To improve the quality of education in government schools in Harisandra | 0.648
,,,,,,4185 | To increase enrollment in government schools by addressing the lack of interest among parents and children | 0.7947
,,,,,,4285 | To increase parent participation in parent-teacher meetings | 0.7434
,,,,,,4302 | To increase parental involvement in the school by creating a presence chart and explaining its importance to the guardians | 0.6683
,,,,,,4304 | To increase parental involvement in education by raising awareness about its importance and encouraging participation in school activities | 0.846
,,,,,,27983 | To improve the quality of education in government schools by involving local women and addressing the issue of lack of teachers | 0.6901
,,,,,,19201 | To enhance the quality of education in government schools by creating reading corners and increasing community involvement | 0.7466
,,,,,,29021 | To increase parental involvement in their children's education | 0.8824
,,,,,,28870 | To improve children's education by increasing parental involvement and support | 0.87
,,,,,,16115 | To increase the number of children in government schools by improving learning outcomes | 0.7701
,,,,,,4093 | To increase parental involvement in school activities and encourage children to attend school regularly | 0.8576
,,,,,,17597 | To improve the education system in government schools by ensuring teachers are present and monitoring students | 0.7016
,,,,,,16344 | To improve the quality of education in government schools and change people's perceptions about it | 0.7167
,,,,,,13850 | To improve the quality of government schools and increase parental trust | 0.8364
,,,,,,4550 | To improve the quality of education in government schools and increase parental trust | 0.8393
,,,,,,15622 | To increase parental participation in school meetings and improve communication between parents and teachers | 0.8073
,,,,,,28437 | To convince parents that extracurricular activities contribute to the mental development of children | 0.6117
,,,,,,29269 | To improve parental care and involvement in children | 0.7677
,,,,,,29273 | To improve registration in a government school by addressing the reasons behind low enrollment | 0.6413
,,,,,,29295 | To improve education by incorporating extracurricular activities and encouraging parental involvement | 0.7576
,,,,,,29477 | To increase parent participation in school meetings by informing them about the importance of these meetings and ensuring they receive the meeting dates. | 0.7222
,,,,,,40391 | To improve teacher-student relationships by addressing the issue of students being angry with teachers | 0.4693
,,,,,,36047 | To improve parental literacy and increase school admissions | 0.7513
,,,,,,37842 | To improve learning outcomes by increasing parental involvement in children's education | 0.8111
,,,,,,40504 | To improve parent-teacher communication and resolve complaints | 0.6641
,,,,,,40446 | To improve the quality of education in government schools by making people aware of the benefits of government schools over private schools | 0.7089
,,,,,,40447 | To improve the education system in government schools by raising awareness about the benefits of government schools over private schools | 0.7114
cd8f6180-67af-4c69-834e-59c4f99fd249,Safe and Respectful Educational Environments,"This theme encompasses initiatives aimed at fostering secure and respectful learning spaces within educational institutions. It focuses on proactive measures, including the establishment of dedicated committees and the implementation of comprehensive awareness programs, to prevent and address issues such as bullying and sexual harassment, thereby ensuring the well-being and safety of all students.","safe learning environment,respectful education,harassment prevention,bullying prevention,student safety,awareness programs,institutional committees",Draft,67,54 | To reduce bullying in school by creating awareness and guidance among students | 0.5506
,,,,,,"29197 | To establish functional sexual harassment prevention committees in schools and colleges, ensuring a safe learning environment for all students. | 0.9097"
,,,,,,29198 | To form and function sexual harassment prevention committees in schools and colleges and develop awareness programs for students | 0.963
,,,,,,"29199 | To form and function sexual harassment prevention committees in schools and colleges, and develop awareness programs for students | 0.9693"
,,,,,,28789 | To create a safe and respectful environment in schools and colleges by forming committees to prevent sexual harassment and organizing awareness programs | 0.8947
,,,,,,28790 | To prevent sexual harassment in colleges and create awareness programs | 0.8967
,,,,,,28791 | To form committees and implement awareness programs to prevent sexual harassment in schools and colleges | 0.9532
,,,,,,28793 | To prevent sexual harassment in schools and colleges by forming committees and conducting awareness programs | 0.9606
,,,,,,28794 | To prevent sexual harassment in schools/colleges by forming committees and raising awareness | 0.9483
,,,,,,28795 | To form committees and conduct awareness programs to prevent sexual harassment in schools and colleges | 0.964
,,,,,,28796 | To form committees and conduct awareness programs to prevent sexual harassment in schools and colleges | 0.964
,,,,,,28797 | To form committees and conduct awareness programs to prevent sexual harassment in schools and colleges | 0.964
,,,,,,28798 | To prevent sexual harassment in schools/colleges by forming committees and conducting awareness programs | 0.9598
,,,,,,28799 | To form committees and conduct awareness programs to prevent sexual harassment in schools and colleges | 0.964
,,,,,,15866 | To create awareness among students about sexual harassment and prevent incidents through the formation of committees and awareness programs | 0.9117
,,,,,,15877 | To create a safe and healthy environment in educational institutions by forming committees to prevent sexual harassment and conducting awareness programs | 0.857
,,,,,,15963 | To create awareness about sexual harassment prevention in schools and colleges | 0.9312
,,,,,,15997 | To develop awareness programs for students and establish sexual harassment prevention committees in schools and colleges | 0.9443
,,,,,,"29189 | To establish and activate sexual harassment prevention committees in schools and colleges, ensuring a safe and supportive learning environment for all students | 0.9477"
,,,,,,29190 | To establish and functionalize sexual harassment prevention committees in schools and colleges | 0.9456
,,,,,,29191 | To prevent sexual harassment in schools and colleges by forming committees and developing awareness programs | 0.9705
,,,,,,15874 | To create a safe and respectful environment in schools and colleges by preventing sexual harassment and promoting awareness among students | 0.8733
,,,,,,15855 | To create a safe and respectful environment in educational institutions by preventing sexual harassment and promoting awareness among students | 0.8528
,,,,,,15865 | To create a safe environment for students in schools and colleges by forming committees to prevent sexual harassment and creating awareness programs | 0.8855
,,,,,,15869 | To create a safe and respectful environment in schools by preventing sexual harassment and promoting awareness among students | 0.8455
,,,,,,15891 | To prevent sexual harassment in schools and colleges by forming and functioning committees and developing awareness programs for students | 0.9751
,,,,,,"15889 | To establish and operate sexual harassment prevention committees in schools and colleges, and develop awareness programs for students | 0.9721"
,,,,,,15892 | To form and functionalize sexual harassment prevention committees in schools and colleges | 0.936
,,,,,,15893 | To form and functionalize sexual harassment prevention committees in schools and colleges and develop awareness programs for students | 0.9642
,,,,,,15977 | To empower girls through education and prevent sexual harassment in schools and colleges | 0.8257
,,,,,,15967 | To empower women through education and create awareness about sexual harassment prevention committees in schools and colleges | 0.9191
,,,,,,"29192 | To establish functional sexual harassment prevention committees in schools and colleges, and develop awareness programs for students to ensure a safe learning environment | 0.9415"
,,,,,,"15969 | To establish functional sexual harassment prevention committees in schools and colleges, ensuring a safe learning environment for students | 0.9269"
,,,,,,"15994 | To establish and maintain effective sexual harassment prevention committees in schools and colleges, ensuring a safe and supportive learning environment for all students. | 0.9235"
,,,,,,16034 | To develop awareness programs for students and establish functional sexual harassment prevention committees in schools and colleges | 0.9341
,,,,,,16035 | To establish sexual harassment prevention committees in schools and colleges and develop awareness programs for students | 0.9687
,,,,,,"16028 | To establish and maintain effective sexual harassment prevention committees in schools and colleges, promoting a safe and respectful learning environment. | 0.9214"
,,,,,,16032 | To create awareness about sexual harassment and develop prevention committees in schools and colleges | 0.9666
,,,,,,16086 | To prevent sexual harassment and create a safe environment for students | 0.8214
,,,,,,29193 | To create a safe and supportive environment for students by establishing sexual harassment prevention committees and developing awareness programs | 0.9193
,,,,,,15851 | To prevent sexual harassment and create a safe environment for students in schools and colleges | 0.8468
,,,,,,15873 | To create awareness among students and prevent sexual harassment in schools and colleges | 0.9022
,,,,,,"15890 | To establish and implement sexual harassment prevention committees in schools and colleges, promoting a safe and respectful learning environment | 0.9409"
,,,,,,15981 | To establish and functionalize sexual harassment prevention committees in schools and colleges | 0.9456
,,,,,,16001 | To empower women leaders in education and promote awareness about sexual harassment prevention committees in schools and colleges | 0.8846
,,,,,,29194 | To prevent sexual harassment in schools and colleges | 0.8639
,,,,,,29195 | To form and functionalize sexual harassment prevention committees in schools and colleges | 0.936
,,,,,,29196 | To form and function sexual harassment prevention committees in schools and colleges and develop awareness programs for students | 0.963
,,,,,,29364 | To prevent sexual harassment in schools and colleges by forming and functioning committees and developing awareness programs for students | 0.9751
,,,,,,"29366 | To form and functionalize sexual harassment prevention committees in schools and colleges, and develop awareness programs for students | 0.9689"
,,,,,,29376 | To empower women through education and create awareness about sexual harassment prevention | 0.8301
,,,,,,32796 | To create a safe environment for students by forming committees to prevent sexual harassment and conducting awareness programs | 0.858
,,,,,,"34234 | To establish and activate sexual harassment prevention committees in schools and colleges, and to develop awareness programs for students to prevent sexual harassment and promote a safe learning environment | 0.9601"
,,,,,,34632 | To address the issue of sexual harassment in schools and colleges by forming prevention committees and developing awareness programs for students | 0.9676
,,,,,,"32759 | To establish committees and conduct awareness programs to prevent sexual harassment in schools and colleges, ensuring a safer learning environment for students | 0.9592"
,,,,,,32789 | To prevent sexual harassment in schools and colleges by forming committees and conducting awareness programs | 0.9606
,,,,,,34611 | To develop awareness programs for students to prevent sexual harassment in schools and colleges | 0.916
,,,,,,32771 | To form committees and conduct awareness programs to prevent sexual harassment in schools and colleges | 0.964
,,,,,,34193 | To address the problem of sexual harassment in schools and colleges | 0.8347
,,,,,,34329 | To create awareness about sexual harassment prevention committees in schools and colleges | 0.9637
,,,,,,34618 | To form and function sexual harassment prevention committees in schools and colleges and develop awareness programs for students | 0.963
,,,,,,32767 | To form committees and conduct awareness programs to prevent sexual harassment in schools and colleges | 0.964
,,,,,,32780 | To prevent sexual harassment in schools/colleges by forming committees and conducting awareness programs | 0.9598
,,,,,,32787 | To prevent sexual harassment in schools and colleges by forming committees and conducting awareness programs | 0.9606
,,,,,,34370 | To develop awareness programs for students and establish sexual harassment prevention committees in schools and colleges | 0.9443
,,,,,,32794 | To form committees and conduct awareness programs to prevent sexual harassment in schools and colleges | 0.964
,,,,,,32777 | To form committees and conduct awareness programs to prevent sexual harassment in schools and colleges | 0.964
4cf6126e-0de4-4b44-823e-6108e6443a90,Enhancing Mathematics Education and Performance,"This theme encompasses initiatives aimed at elevating the quality of mathematics instruction and learning within educational settings. It focuses on improving both student achievement and engagement through pedagogical strategies, teacher development, and the integration of innovative learning approaches.","mathematics education,student performance,teacher development,pedagogical innovation,student engagement",Draft,65,1 | Improve teacher performance in maths | 0.7885
,,,,,,58 | Improve math education in school | 0.7614
,,,,,,9 | Improve math performance of students | 0.7753
,,,,,,128 | To enhance maths education by integrating hands-on activities that help students understand abstract concepts through real-world applications | 0.7074
,,,,,,60 | To enhance student engagement and performance in mathematics | 0.8156
,,,,,,21 | Improve math skills of grade 8 students | 0.7402
,,,,,,33 | To improve the students performance in maths by providing teachers with worksheets to work on. | 0.7688
,,,,,,32 | Improve teacher math skills | 0.8114
,,,,,,66 | To improve the teaching of maths in school | 0.8288
,,,,,,43 | Improve math skills of students | 0.8194
,,,,,,44 | To improve student engagement and understanding of concepts through activity-based learning | 0.6428
,,,,,,45 | Improve student engagement and performance | 0.6726
,,,,,,131 | To improve student confidence and learning outcomes through innovative teaching techniques and teacher dedication. | 0.6731
,,,,,,157 | To improve teacher confidence and student engagement with digital tools | 0.6143
,,,,,,34 | Improve math education in school | 0.7614
,,,,,,53 | Improve teacher skills to enhance student performance | 0.7776
,,,,,,192 | To improve teacher performance by providing test worksheets | 0.6746
,,,,,,91 | Improve teaching capabilities and student learning | 0.6788
,,,,,,106 | Improve 10th grade pass percentage | 0.4939
,,,,,,135 | To improve student engagement and attendance by introducing Project Based Learning (PBL) and making learning more relevant and interactive | 0.6356
,,,,,,112 | To enhance maths education by providing teachers with test sheets to improve their teaching methods | 0.7758
,,,,,,136 | To increase student attendance and engagement by implementing Project Based Learning (PBL) | 0.6222
,,,,,,137 | The objective of the micro-improvement was to improve student engagement and motivation by making learning more relevant and interactive. | 0.6411
,,,,,,138 | To increase student attendance and engagement by implementing Project Based Learning | 0.6752
,,,,,,152 | To reduce math anxiety and improve student engagement and confidence in learning math | 0.6989
,,,,,,185 | To improve student engagement and attendance by introducing Project Based Learning | 0.6688
,,,,,,141 | To improve students' understanding and fluency in multiplication tables through daily practice sessions | 0.5622
,,,,,,125 | To enhance student engagement and attendance by introducing Project Based Learning | 0.6629
,,,,,,126 | To increase student engagement and motivation by introducing project-based learning | 0.6236
,,,,,,"144 | To make math a fun and accessible subject for all students, regardless of their background or ability | 0.696"
,,,,,,140 | To enhance conceptual understanding in Mathematics through experiential learning | 0.6682
,,,,,,28599 | To improve math skills of children by providing extra classes | 0.808
,,,,,,162 | To improve math education by making it more engaging and interactive | 0.8062
,,,,,,3354 | To enhance teacher technical knowledge and modern teaching methods | 0.6745
,,,,,,3684 | To improve in a subject where the teacher was not supportive | 0.6203
,,,,,,3648 | To improve understanding and performance in a subject despite an unsupportive teacher | 0.6648
,,,,,,14920 | To improve counting skills among children through interactive math games and activities | 0.6422
,,,,,,3779 | To enhance math education by providing proper study materials and conducting special classes | 0.7544
,,,,,,41630 | To enhance teacher skills in teaching maths | 0.8459
,,,,,,"40666 | To address the issue of teachers being assigned non-academic tasks, affecting their ability to focus on teaching and completing the syllabus. | 0.6427"
,,,,,,28685 | To improve math education by providing teachers with necessary skills | 0.8244
,,,,,,40680 | To improve mathematics education in rural areas by increasing awareness and interest among children and parents | 0.6762
,,,,,,40784 | To improve classroom participation and develop essential 21st-century skills among students through the use of a structured task-based teaching strategy in science classrooms | 0.5625
