Theme Id,Theme Name,Definition,Keywords,Status,Objective Count,Original Statements
,,,,,,7586 | To create awareness about the importance of education among parents in Kharwa village | 0.8228
,,,,,,8988 | To create awareness about the importance of education among children and parents in Shivhar | 0.7867
,,,,,,"3301 | To improve the quality of education in Kinnari Village by addressing the lack of basic facilities, recruiting subject-wise teachers, and creating a playground. | 0.7094"
,,,,,,5006 | To improve the education system in Hosabudanooru village by increasing parental support and student motivation | 0.7808
,,,,,,4549 | To increase awareness about the importance of education and improve school attendance in Halebudanuru Village | 0.7934
,,,,,,4551 | To improve education in Halebudanuru village by increasing awareness about the importance of education and providing support to families who rely on daily wages | 0.7754
,,,,,,4614 | To improve education in Boothana Hosuru Village by addressing the issues of poverty and parental mindset | 0.7416
,,,,,,4703 | To educate children about their rights and provide psychological education through a village council program | 0.6765
,,,,,,5024 | To improve education in Hosabudanooru village by reducing the financial burden on families and encouraging children to attend school regularly | 0.8147
,,,,,,7848 | To improve education in Sakra Munsurpur by encouraging parents to send their children to school and explaining the importance of education | 0.8125
,,,,,,29187 | To improve school attendance in Rohtas by organizing a rally and creating awareness among parents and children | 0.6873
,,,,,,27810 | To raise awareness about education and to tell about education in villages which are deprived of education | 0.8326
,,,,,,15187 | To improve education in Shivhar by encouraging children to attend school and increasing awareness among the community | 0.7916
,,,,,,16828 | To improve education in Baknar village by convincing parents to send their children to school | 0.8522
,,,,,,28824 | To improve education in Avati village by creating awareness and supporting unenrolled children | 0.8313
,,,,,,15726 | To improve education in Laptaha village by encouraging children to attend school | 0.8456
,,,,,,3281 | To improve the education in Ramkrishna School by providing necessary books to the students | 0.6494
,,,,,,3353 | To improve the quality of education in Mallarahalli by providing evening classes for children | 0.7193
,,,,,,11724 | To improve education in Mathh Majhauli by ensuring children attend school on time and teachers take care of them | 0.7335
,,,,,,15793 | To improve education in the village by ensuring regular attendance and providing important educational information | 0.8225
,,,,,,15257 | To increase school attendance in the village | 0.7897
,,,,,,4161 | To improve education in Mala Toli village by raising awareness about its importance and providing facilities to children | 0.8145
,,,,,,4548 | To improve education in Halebudanuru village by addressing poverty and lack of facilities | 0.733
,,,,,,28838 | To improve the education system in Ratanpur Bagahi by increasing teacher accountability and parental involvement | 0.7339
,,,,,,15334 | To improve education in Patharaura village by encouraging children to attend school | 0.849
,,,,,,29101 | To improve access to education for children in Auravaa Tilha by increasing awareness among parents and providing remedial classes | 0.7368
,,,,,,3996 | To ensure all children in Lembua Village have access to safe and quality education | 0.7416
,,,,,,3984 | To improve education in the Mushahar and Bhangi caste settlements | 0.6675
,,,,,,3988 | To promote education among children in Jay Prakash Nagar by raising awareness among parents and encouraging them to send their children to school | 0.7596
,,,,,,29014 | To promote education in Kamalpur village by starting a remedial school for weak children and encouraging parents to send their children to school | 0.8265
,,,,,,3763 | To improve the condition of the village school | 0.7673
,,,,,,4990 | To increase the number of boys attending school in Halebudanuru Village by addressing the financial pressure on families and the lack of awareness about the importance of education | 0.8029
,,,,,,13943 | To educate the children of the village who were not studying due to the school being far away | 0.7136
,,,,,,30676 | To improve the educational process in Banglihundi Graama by encouraging parents to pay attention to teachers and their children | 0.8068
,,,,,,29212 | To improve school attendance by addressing child labour and early marriage in Gaanv Ropahatha | 0.7217
,,,,,,19944 | To improve education in Shivhar by addressing the shortage of teachers and education in schools | 0.7044
,,,,,,19525 | To ensure every boy and girl in the village attends school and receives an education | 0.7855
,,,,,,28888 | To improve education in Shivhar by increasing awareness among children and parents about the importance of education | 0.7893
,,,,,,19057 | To improve education in Gaojakhini by addressing the shortage of rooms and teachers in the school | 0.6908
,,,,,,16934 | To increase awareness about the importance of education among illiterate guardians in Ratanpur | 0.6637
,,,,,,20402 | To improve education in Khizersarai by ensuring that children receive a good education | 0.7128
,,,,,,4159 | To improve the expression of students in High School Bariyarpur by providing a supportive environment and encouraging participation. | 0.649
,,,,,,15363 | To improve adolescent education in Nandwara Bairganiya by raising awareness about its importance and providing support to teenagers | 0.7802
,,,,,,3983 | To improve the education of children from the Mushahar and Bhangi caste settlements | 0.748
,,,,,,29215 | To ensure all children in the village have the necessary documents for school admission | 0.7032
,,,,,,3883 | To improve education in Muzaffarpur by addressing the issue of poverty and lack of attention to studies | 0.6518
,,,,,,3778 | To improve the education system in Madapur Village by addressing the shortage of teachers and basic amenities in government schools | 0.786
,,,,,,"4555 | To improve education in Kannali Village by addressing parental mindset, financial constraints, and lack of facilities | 0.7862"
,,,,,,5008 | To improve education in Hosabudanooru village by engaging the community and providing resources to families | 0.8159
,,,,,,5016 | To improve education in Hosabudanooru village by providing bridging classes and linking families with microcredit and skill training opportunities | 0.74
,,,,,,5020 | To improve the educational outcomes of boys in Hosabudanooru village by addressing the lack of interest in learning and providing individualized support. | 0.742
,,,,,,4149 | To improve education among the people of Birachhapra village by raising awareness and promoting education | 0.7802
,,,,,,"3288 | To address the lack of teachers, books, and playground in Saptagiri school | 0.6492"
,,,,,,15302 | To improve education in Hardiya village by addressing poverty and lack of money | 0.7648
,,,,,,4148 | To improve communication with the Head Master and ensure successful implementation of programs | 0.4217
,,,,,,4220 | To improve the educational experience of students in Bandra by organizing a Pravesh Utsav and connecting the school with the community | 0.6381
,,,,,,29048 | To improve education in the village by raising awareness about the importance of education | 0.863
,,,,,,5011 | To improve education in Hosabudanooru village by addressing financial constraints and parental mindset | 0.7337
,,,,,,28939 | To provide quality education to drafted out children in tribal areas and make them socially and mentally complete | 0.6546
,,,,,,28474 | To provide basic education to all children in the village | 0.7534
,,,,,,29235 | To increase awareness about education among children and parents in Saraya village and encourage regular school attendance | 0.8555
,,,,,,29324 | To increase awareness about the importance of education among parents and children in the village | 0.8501
,,,,,,"29368 | To improve education in Afzalpur village by encouraging children to attend school and coaching classes, thereby addressing the issue of weak economic situation due to lack of education | 0.7971"
,,,,,,29393 | To improve the education system in Bishanpur village by addressing the lack of order in school and ensuring regular attendance of children | 0.7701
,,,,,,29399 | To improve education in villages by educating parents and children about its importance | 0.887
,,,,,,29401 | To increase awareness and importance of education among children in Khopraha village | 0.8411
,,,,,,29404 | To educate all children in Parsa Kala village and make them aware of the importance of education | 0.8504
,,,,,,29415 | To improve education in Graam Masahi by increasing awareness and encouraging children to attend school regularly | 0.7998
,,,,,,29418 | To empower education in Dandaniya by encouraging parents to send their children to school | 0.7828
,,,,,,29440 | To improve education in Patal Bigha village by increasing school attendance and providing remedial classes for children who were shy to attend school due to weak studies | 0.7993
,,,,,,"29481 | To improve parental engagement and awareness about the importance of education in Sakra Vajid, Muzaffarpur | 0.7659"
,,,,,,29510 | To increase awareness about education among parents and children in Bagaha Tolla | 0.7938
,,,,,,37076 | To promote education and equality among Scheduled Caste children by providing free course coaching and raising awareness about government schemes | 0.6715
,,,,,,40420 | To enhance the quality of education in Kosgi by addressing the lack of awareness and resources | 0.6333
,,,,,,40419 | To improve education in Nacharam by engaging with the community and teachers | 0.7414
,,,,,,40472 | To improve education in Sikta village by organizing Education Chaupal and meetings with parents and village heads | 0.8046
,,,,,,30595 | To improve education in Kamalpura village by addressing the lack of toilets and drinking water in the school | 0.7242
,,,,,,33455 | To improve academic education of children in Machchare Graama by providing tutoring and encouraging parental involvement | 0.6935
,,,,,,"40423 | To educate underprivileged children in the village of Rohtas, Prakhand Tilawat, by informing their parents about the importance of education and the provisions available in government schools. | 0.7539"
,,,,,,"33855 | To improve education in Khanpura by addressing the issues of child marriage, child labour, and lack of access to education | 0.7615"
,,,,,,40502 | To improve parental engagement in education by conducting regular meetings and motivating villagers to send their children to school | 0.7609
,,,,,,"31443 | To provide equal education facilities to all children in the village, regardless of their caste | 0.7209"
,,,,,,40440 | To improve the education system in Phuli village by promoting government schools and highlighting their benefits. | 0.7276
,,,,,,32274 | To improve education in Barwa Gaav by addressing the issue of children being unable to afford Anganwadi expenses | 0.7131
,,,,,,40424 | To spread awareness about the importance of education and provide information about government facilities to parents in Dihariya village | 0.7944
,,,,,,35376 | To improve education in Donon Tolly Gaanv by ensuring children attend school on time and focus on their studies | 0.7359
5a6416c0-4828-4ca1-b5fd-c1288fe7acf3,Girls' Empowerment Through Education and Prevention of Early Marriage,"This theme encompasses initiatives aimed at fostering girls' educational attainment and agency, directly addressing the societal and familial barriers that lead to child marriage. It focuses on empowering girls with knowledge, skills, and awareness to make informed decisions about their futures, including delaying marriage until adulthood and pursuing educational and economic opportunities.","girls' education,child marriage prevention,gender equality,adolescent empowerment,societal change",Draft,185,5014 | To change parental attitudes that favor boys over girls in education | 0.6852
,,,,,,28523 | To educate girls and avoid child marriage | 0.9162
,,,,,,28535 | To encourage girls to pursue education and prevent child marriage | 0.9498
,,,,,,8061 | To prevent child marriages by creating awareness | 0.7371
,,,,,,28537 | To promote education and prevent child marriage and child labor | 0.8259
,,,,,,15007 | To empower girls through education and ensure they get married at a suitable age | 0.8997
,,,,,,28543 | To educate Radhika and prevent child marriage | 0.6666
,,,,,,28608 | To empower adolescent girls through education and prevent child marriage | 0.8879
,,,,,,28455 | To educate parents about the importance of equality and not allowing discrimination between boys and girls | 0.736
,,,,,,15511 | To empower daughters-in-law to pursue their education and become financially independent | 0.6268
,,,,,,14941 | To educate girls and stop early marriage | 0.8865
,,,,,,28613 | To raise awareness about the importance of education and prevent child marriage in Balbhadra village | 0.661
,,,,,,41559 | To empower girls through education and make them aware of the importance of education | 0.8554
,,,,,,40610 | To stop child marriage and ensure education for children in Gurhani village | 0.7058
,,,,,,"40625 | To empower girls in the village panchayat to make their own decisions and take control of their lives through education, preventing child marriage | 0.8013"
,,,,,,40629 | To empower girls through education and make them aware of its importance | 0.8586
,,,,,,41655 | To promote girl education and empower them to pursue their dreams | 0.8218
,,,,,,41657 | To promote girl child education and empower them through education | 0.8509
,,,,,,3837 | To prevent child marriage in Jakkalli by conducting an awareness program on its consequences | 0.6261
,,,,,,40699 | To prevent child marriage and promote education among boys and girls in the village | 0.8295
,,,,,,40715 | To empower girls through education and help them understand its importance | 0.8517
,,,,,,40845 | To empower girls through education and prevent child labor | 0.8353
,,,,,,40799 | To empower girls through education and reduce child marriage | 0.9327
,,,,,,40865 | To prevent child marriage and promote education among teenage girls | 0.8647
,,,,,,40885 | To educate parents about the importance of education and prevent child marriage | 0.8488
,,,,,,40921 | To empower girls through education and prevent child marriage | 0.959
,,,,,,4142 | To address the issue of girls not attending school and child marriage in the community | 0.8263
,,,,,,41043 | To educate girls about the importance of education and the negative impacts of child marriage | 0.8859
,,,,,,16548 | To empower girls through education by ensuring their safety on the way to school | 0.8036
,,,,,,41176 | To empower girls through education and prevent child marriage | 0.959
,,,,,,41184 | To empower girls through education and prevent child marriage | 0.959
,,,,,,41190 | To promote girl education and empower them to make informed decisions about their lives | 0.8498
,,,,,,5905 | To address the issue of child marriage and encourage girls to stay in school | 0.8912
,,,,,,"41219 | To prevent child marriage and encourage girls to continue their studies, thereby empowering them to make informed decisions about their lives. | 0.8283"
,,,,,,4035 | To empower a minor girl to complete her education by raising awareness about the importance of education and the legal implications of marrying a minor | 0.7531
,,,,,,41267 | To empower girls through education and prevent child marriage | 0.959
,,,,,,41268 | To empower girls through education and reduce child marriage | 0.9327
,,,,,,3968 | To empower girls through education and make them aware of its importance | 0.8586
,,,,,,40517 | To provide educational opportunities to underprivileged girls and empower them through knowledge | 0.7858
,,,,,,41285 | To empower girls through education and make them aware of its importance | 0.8586
,,,,,,40531 | To promote girls' education and empower them through knowledge | 0.7949
,,,,,,40543 | To educate girls and prevent child marriage | 0.928
,,,,,,40545 | To encourage girls' education in rural Rohtas by advising parents to educate their daughters at least until they grow up and then marry them off | 0.823
,,,,,,41430 | To empower girls through education and prevent child marriage | 0.959
,,,,,,41452 | To educate the girl child and prevent child marriage | 0.8968
,,,,,,28629 | To educate girls about the importance of education and the disadvantages of early marriage | 0.8586
,,,,,,48923 | To empower women and children through education and make them aware of its importance | 0.7914
,,,,,,48955 | To empower girls through education and make them aware of its importance | 0.8586
,,,,,,48958 | To promote girls' education | 0.7805
,,,,,,49009 | To stop child marriage and promote education for girls | 0.9268
,,,,,,49028 | To educate parents about the importance of girls' education and to stop child marriage | 0.917
,,,,,,49026 | To encourage girls to study and not get married at a young age | 0.7785
,,,,,,5803 | To educate girls and prevent child marriage | 0.928
,,,,,,28704 | To empower girls through education and make them aware of its importance | 0.8586
,,,,,,6924 | To increase the age of education and prevent child marriage by improving teacher accountability and community awareness | 0.7085
,,,,,,4223 | To make a girl from the slum sit in classes and educate her about her rights and importance of education | 0.6733
,,,,,,4234 | To empower a community by providing education and promoting the importance of education for girls. | 0.8349
,,,,,,4247 | To discuss human rights in the task force group and find a solution for a girl who ran away and was traded | 0.3668
,,,,,,4254 | To raise awareness against child marriage and promote education among girls | 0.8776
,,,,,,7284 | To promote girls' education | 0.7805
,,,,,,4280 | To empower girls through education and help them understand their rights and responsibilities | 0.8533
,,,,,,4289 | To reduce child marriage by raising awareness through rallies and slogans | 0.6636
,,,,,,8066 | To educate women about the problems caused by child marriage and encourage them to cooperate in preventing it | 0.8564
,,,,,,"7972 | To ensure every child, regardless of gender, has access to education and to prevent early marriage. | 0.7647"
,,,,,,28720 | To create awareness about the negative impacts of child marriage among children and to encourage them to report such cases. | 0.6983
,,,,,,5700 | To stop child marriage and empower girls | 0.8576
,,,,,,7598 | To empower girls through education and prevent child marriage | 0.959
,,,,,,18142 | To educate villagers about the importance of educating their children before marriage and preventing child marriage | 0.7642
,,,,,,6715 | To promote equality in education for both sons and daughters | 0.7647
,,,,,,28744 | To create awareness among children about the problems caused by child marriage and to prevent it | 0.7399
,,,,,,28752 | To stop child marriage in the village | 0.6833
,,,,,,8530 | To ensure girls attend school regularly and delay marriage until the age of 18 | 0.8244
,,,,,,16474 | To prevent child marriage by educating children and their parents about its negative consequences and promoting self-reliance | 0.7877
,,,,,,9212 | To educate parents about the importance of not marrying their children before the age of 18 and to encourage them to educate their children | 0.7933
,,,,,,15046 | To create awareness about education and curb child marriage | 0.8203
,,,,,,10450 | To encourage girls to attend school and prevent child marriage | 0.9099
,,,,,,10397 | To reduce early marriage and promote education among girls in the community | 0.8163
,,,,,,10470 | To prevent child marriage by educating parents and adolescents about its negative consequences and promoting vocational training for adolescent empowerment | 0.7132
,,,,,,15117 | To educate girls and make them aware of their rights | 0.8037
,,,,,,4205 | To prevent child marriage and encourage girls to pursue their education by engaging grandparents and the community | 0.8807
,,,,,,12586 | To empower girls through education and prevent child marriage | 0.959
,,,,,,28792 | To create awareness about the importance of education for girls and the legal consequences of child marriage | 0.8829
,,,,,,11473 | To empower daughters through education and delay their marriage until they are ready | 0.8313
,,,,,,4196 | To empower girls through education and prevent child marriage | 0.959
,,,,,,15038 | To empower adolescent girls in the community by providing them with access to higher education and making them aware of the importance of education. | 0.7691
,,,,,,15488 | To empower teenage girls through education and make them aware of its importance | 0.8004
,,,,,,"15053 | To educate parents about the importance of education for girls and the legal consequences of child marriage, and to encourage them to support their daughters | 0.8812"
,,,,,,10437 | To stop child marriage and promote education | 0.8462
,,,,,,3995 | To empower girls through education and make them aware of its importance | 0.8586
,,,,,,16260 | To empower girls through education and prevent child marriage | 0.959
,,,,,,"13887 | To raise awareness about child marriage among children in Varuna, Mysuru, Karnataka | 0.5893"
,,,,,,15242 | To ensure equal rights to education for boys and girls | 0.7481
,,,,,,23308 | To educate adolescent girls and make them aware of their rights and responsibilities | 0.7795
,,,,,,23288 | To improve school safety and education for girls by building a boundary and promoting education over early marriage | 0.8495
,,,,,,25421 | To empower girls by educating them and making their parents aware of the importance of education | 0.8629
,,,,,,27237 | To empower women and children through education and prevent child marriage | 0.8892
,,,,,,8060 | To educate women about the problems caused by child marriage and encourage them to take action against it | 0.8419
,,,,,,7875 | To solve the problem of child marriage in the village | 0.6341
,,,,,,13909 | To educate and raise awareness about the negative impacts of child marriage among the community | 0.7079
,,,,,,16568 | To empower girls through education by making parents aware of its importance | 0.843
,,,,,,8540 | To create awareness about the negative effects of child marriage and promote education among girls | 0.867
,,,,,,11101 | To educate and empower women against child marriage through door-to-door awareness campaigns | 0.661
,,,,,,11113 | To educate and empower women against child marriage through door-to-door awareness campaigns | 0.661
,,,,,,4204 | To promote girls education and empower them to become strong women | 0.7841
,,,,,,13443 | To empower girls through education and prevent child marriage | 0.959
,,,,,,4018 | To promote education and empower girl children to stand on their own feet | 0.6993
,,,,,,3985 | To create awareness about the importance of higher education for girls and the harmful effects of child marriage and mismatched marriages | 0.8133
,,,,,,13917 | To educate children about the problems caused by child marriage and promote awareness | 0.8105
,,,,,,4259 | To encourage girls to pursue education and delay marriage | 0.8769
,,,,,,4262 | To empower girls and prevent child marriage through education and awareness | 0.9456
,,,,,,28820 | To educate girls and delay their marriage until they are 18 years old | 0.8238
,,,,,,8075 | To create awareness about child marriage in schools | 0.7662
,,,,,,18242 | To improve education by engaging the community and stopping child marriage | 0.7897
,,,,,,9387 | To raise awareness about the negative effects of child marriage and promote education as a means to prevent it | 0.8409
,,,,,,10457 | To educate girls and women in rural areas and delay child marriages | 0.7611
,,,,,,11478 | To ensure girls in Amma Bigha village can safely attend school by building a road and addressing the issue of child marriage | 0.6807
,,,,,,15484 | To educate girls about the harm caused by early marriage | 0.83
,,,,,,15504 | To promote girls' education and equality | 0.7969
,,,,,,3854 | To increase the education of girls in the community by stopping child marriage | 0.8909
,,,,,,15277 | To resolve the problem of girls leaving school after fifth or eighth grade due to child marriage | 0.7249
,,,,,,15281 | To empower girls through education and prevent child marriage | 0.959
,,,,,,4155 | To stop child marriage in Peerapur village by educating parents and community members about its harmful effects and legal consequences | 0.6897
,,,,,,4034 | To promote girl education and eliminate child marriage in the community | 0.8899
,,,,,,3974 | To empower girls through education and prevent child marriage | 0.959
,,,,,,12908 | To empower girls through education and prevent child marriage | 0.959
,,,,,,3969 | To empower girls in the community by delaying marriages until they complete their education | 0.8659
,,,,,,3887 | To empower girls through education and make them aware of its importance | 0.8586
,,,,,,3757 | To empower women to take a stand against child marriage and create a positive impact in their community | 0.7779
,,,,,,4140 | To stop child marriage and encourage girls to study by celebrating Grandparents Day | 0.7121
,,,,,,28853 | To empower girls through education and stop child marriage | 0.9461
,,,,,,29104 | To motivate girls to pursue education and reduce child marriage | 0.8861
